{
  "type": "vampirism:alchemical_table",
  "common_info": {},
  "ingredient": {
    "neoforge:ingredient_type": "neoforge:components",
    "components": {
      "vampirism:oil_contents": {
        "oil": "vampirism:plant"
      }
    },
    "items": "vampirism:oil_bottle"
  },
  "input": "vampirism:item_alchemical_fire",
  "result": {
    "components": {
      "vampirism:oil_contents": {
        "oil": "vampirism:spitfire"
      }
    },
    "id": "vampirism:oil_bottle"
  }
}