{
  "type": "vampirism:alchemical_table",
  "ingredient": {
    "type": "neoforge:components",
    "components": {
      "vampirism:oil_contents": {
        "oil": "vampirism:vampire_blood"
      }
    },
    "items": "vampirism:oil_bottle"
  },
  "input": [
    {
      "type": "neoforge:components",
      "components": {
        "minecraft:potion_contents": {
          "potion": "minecraft:slow_falling"
        }
      },
      "items": "minecraft:potion"
    },
    {
      "type": "neoforge:components",
      "components": {
        "minecraft:potion_contents": {
          "potion": "minecraft:long_slow_falling"
        }
      },
      "items": "minecraft:potion"
    }
  ],
  "result": {
    "components": {
      "vampirism:oil_contents": {
        "oil": "vampirism:slow_falling"
      }
    },
    "count": 1,
    "id": "vampirism:oil_bottle"
  }
}